{
  "schema_version": 1,
  "fixture_id": "controller-lease-settlement-v1",
  "license": "GPL-3.0-only",
  "scope": "Controller D1 software settlement only; Hardware Unverified and no Stage 1 refreeze",
  "acquire": {
    "outcomes": ["Granted", "Cancelled", "Deadline", "Closed", "Failure"],
    "same_observation_priority": ["Cancelled", "Deadline", "Closed", "Failure", "Granted"],
    "deadline_clock": "absolute target_ns in the owning Runtime Clock epoch",
    "abandoned_future": "an unresolved record cannot grant; an unobserved granted lease falls back to the same generation cleanup"
  },
  "actions": {
    "generation_nonzero": true,
    "effect_boundary": "Succeeded only when the backend settlement gate consumes the physical final-byte completion for the complete logical report",
    "backend_final_byte": "ordinary direct, Automation direct, and the effect-completing final precise-sequence report bind one Operation settlement owner to the backend gate; the unique physical completion owner reserves FullAccepted before Clock, telemetry, or hook work, so late cancellation or close cannot take the owner; reservation rejection fails closed and duplicate completion cannot fabricate FullAccepted",
    "intermediate_sequence": "an accepted non-final precise-sequence report is not whole-operation success; cancellation or failure before final acceptance settles its neutral and stream before the operation terminal",
    "sealed_action": "release seals admission, cancels uneffected admitted actions, settles each action, then dispatches one neutral",
    "partial_io": "a partial logical write that cannot complete closes the stream before action or release settlement"
  },
  "release": {
    "states": ["Undispatched", "Outstanding", "GateClaimed", "Committed"],
    "accepted": "NeutralAccepted",
    "not_delivered": "NeutralNotDeliveredStreamSettled(cause)",
    "failure": "Err(cleanup_failure) only after a legitimate owner has proved completion and stream settlement; missing owner/evidence is ownership loss rather than release failure",
    "pacing": "neutral target is max(Runtime Clock now, last accepted report plus minimum interval)",
    "close_after_settlement": "a close that acquires a record before backend final-byte reservation consumes its same neutral; GateClaimed or retained Committed lane-owned records cannot consume a later resource close, which dispatches one independent paced final neutral"
  },
  "cleanup": {
    "proven_owner": {
      "precondition": "a legitimate Controller lane owner consumed the completion and proved stream settlement before later cleanup failure",
      "waiter": "every affected action and release waiter completes exactly once with the same Err(cleanup_failure)",
      "close": "the Controller permanently seals admission, preserves the first failure, and Runtime close reports CloseFailed after required join"
    },
    "ownership_loss": {
      "precondition": "Controller lane ownership is lost and no transferable owner, completion, or stream-settlement evidence is provable",
      "waiter": "the affected action and release waiter stay nonterminal and are not woken",
      "close": "the record and registry identity remain for diagnosis and Runtime close reports CloseFailed"
    }
  },
  "close": {
    "takes_over_release": true,
    "retry_interrupted_neutral": false,
    "traverses_all_records": true,
    "waiters": "close seals acquire and action admission, settles acquire/action/release waiters including records registered after close seal, then joins the lane"
  },
  "serial": {
    "cancelioex": "Windows CancelIoEx requests interruption only",
    "completion_owner": "the unique Windows completion owner reserves and publishes final-byte settlement before returning a full count to the Controller lane"
  },
  "obligation_matrix": [
    {
      "id": "controller.lease.acquire-cancelled",
      "adr": "ADR-0018:91-129",
      "expect": "a cancelled acquire resolves Cancelled before lane grant",
      "test": "tests/support/tests/controller_lease.rs::cancelled_acquire_wins_before_lane_grant",
      "marker": "controller.lease.acquire-cancelled"
    },
    {
      "id": "controller.lease.acquire-deadline",
      "adr": "ADR-0018:91-129",
      "expect": "an absolute Runtime-clock acquire deadline settles without lane progress",
      "test": "tests/support/tests/controller_lease.rs::system_clock_acquire_deadline_settles_without_lane_progress",
      "marker": "controller.lease.acquire-deadline"
    },
    {
      "id": "controller.lease.acquire-failure",
      "adr": "ADR-0018:91-129",
      "expect": "busy admission projects Failure without granting another lease",
      "test": "tests/support/tests/controller_lease.rs::busy_acquire_projects_failure_without_grant",
      "marker": "controller.lease.acquire-failure"
    },
    {
      "id": "controller.lease.acquire-same-point-priority",
      "adr": "ADR-0018:91-104",
      "expect": "Cancelled, Deadline, Closed, and Failure retain the specified same-observation priority",
      "test": "crates/easycon-controller/src/session.rs::acquire_record_uses_stable_same_point_priority",
      "marker": "controller.lease.acquire-same-point-priority"
    },
    {
      "id": "controller.lease.acquire-abandonment",
      "adr": "ADR-0018:104-109",
      "expect": "a dropped unresolved acquire cannot later grant a lease",
      "test": "crates/easycon-controller/src/session.rs::abandoned_acquire_record_rejects_a_late_grant_transition",
      "marker": "controller.lease.acquire-abandonment"
    },
    {
      "id": "controller.lease.generation-non-reuse",
      "adr": "ADR-0018:26-32",
      "expect": "successive lease generations are non-zero and never reused",
      "test": "tests/support/tests/controller_lease.rs::successive_lease_generations_are_nonzero_and_not_reused",
      "marker": "controller.lease.generation-non-reuse"
    },
    {
      "id": "controller.lease.generation-wrong-controller",
      "adr": "ADR-0018:26-30",
      "expect": "a lease from another Controller cannot authorize an action",
      "test": "tests/support/tests/controller_lease.rs::wrong_controller_lease_is_rejected_without_affecting_its_owner",
      "marker": "controller.lease.generation-wrong-controller"
    },
    {
      "id": "controller.lease.generation-stale-sealed",
      "adr": "ADR-0018:132-149",
      "expect": "a sealed generation rejects stale action admission before submission",
      "test": "crates/easycon-controller/src/session.rs::sealed_generation_rejects_stale_action_admission",
      "marker": "controller.lease.generation-stale-sealed"
    },
    {
      "id": "controller.lease.action-seal-inflight",
      "adr": "ADR-0018:132-144",
      "expect": "release interrupts an uneffected in-flight generation action before neutral acceptance",
      "test": "tests/support/tests/controller_lease.rs::release_interrupts_an_uneffected_generation_action_before_neutral",
      "marker": "controller.lease.action-seal-inflight"
    },
    {
      "id": "controller.lease.action-seal-future",
      "adr": "ADR-0018:132-149",
      "expect": "a sealed future action settles without waiting for its former target",
      "test": "tests/support/tests/controller_lease.rs::release_cancels_a_future_generation_action_without_waiting_for_its_target",
      "marker": "controller.lease.action-seal-future"
    },
    {
      "id": "controller.lease.drop-cleanup",
      "adr": "ADR-0018:175-190",
      "expect": "Drop seals a lease and starts its one neutral cleanup before another grant",
      "test": "tests/support/tests/controller_lease.rs::dropping_a_lease_starts_one_neutral_cleanup_before_next_grant",
      "marker": "controller.lease.drop-cleanup"
    },
    {
      "id": "controller.lease.release-pacing",
      "adr": "ADR-0018:31-32",
      "expect": "the release neutral does not dispatch before the shared pacing target",
      "test": "tests/support/tests/controller_lease.rs::release_neutral_does_not_dispatch_before_its_pacing_target",
      "marker": "controller.lease.release-pacing"
    },
    {
      "id": "controller.lease.release-accepted",
      "adr": "ADR-0018:151-169",
      "expect": "a fully accepted neutral settles its release waiter as NeutralAccepted",
      "test": "tests/support/tests/controller_lease.rs::release_accepts_one_neutral_and_settles_its_waiter",
      "marker": "controller.lease.release-accepted"
    },
    {
      "id": "controller.lease.partial-stream-settlement",
      "adr": "ADR-0020:252-268",
      "expect": "partial automation I/O settles the stream before release reports not-delivered",
      "test": "tests/support/tests/controller_lease.rs::partial_automation_write_failure_settles_stream_before_release",
      "marker": "controller.lease.partial-stream-settlement"
    },
    {
      "id": "controller.lease.cleanup-failure-projection",
      "adr": "ADR-0020:289-305",
      "expect": "one typed cleanup failure projects identically to action and sealed release waiters",
      "test": "tests/support/tests/controller_lease.rs::action_cleanup_failure_is_projected_to_its_sealed_release",
      "marker": "controller.lease.cleanup-failure-projection"
    },
    {
      "id": "controller.close.strict-failure-pending-report",
      "adr": "ADR-0020:289-305",
      "expect": "a typed final checked-close failure overrides a pending report's close cancellation and projects the same Runtime close failure",
      "test": "tests/support/tests/controller_lease.rs::final_close_failure_overrides_a_pending_report_cancellation",
      "marker": "controller.close.strict-failure-pending-report"
    },
    {
      "id": "controller.connect.strict-cleanup-over-cancel",
      "adr": "ADR-0020:289-305",
      "expect": "a proven connect-recovery checked-close error or panic overrides an already registered cancellation and permanently seals admission",